Author,Publishing Date,Text
[],10/4/2021,"National Bank Financial Inc. is acting as exclusive financial advisor to Surge with respect to the Transaction. ATB Capital Markets and Scotiabank have been appointed strategic advisors to Surge on the Transaction. McCarthy Tétrault LLP is acting as legal advisor to Surge with respect to the Transaction.

Peters & Co. Limited is acting as exclusive financial advisor to Fire Sky. TingleMerrett LLP is acting as legal advisor to Fire Sky with respect to the Transaction.

FORWARD LOOKING STATEMENTS:

This press release contains forward-looking statements. The use of any of the words “anticipate”, “continue”, “estimate”, “expect”, “may”, “will”, “project”, “should”, “believe” and similar expressions are intended to identify forward-looking statements. These statements involve known and unknown risks, uncertainties and other factors that may cause actual results or events to differ materially from those anticipated in such forward-looking statements.

More particularly, this press release contains statements concerning management’s expectations and assumptions concerning the anticipated benefits of the Transaction and the transaction metrics related thereto; the timing of various matters in connection with the Transaction and the conditions to completion of the Transaction; and Surge’s revised guidance for the remainder of 2021 and preliminary guidance for 2022. The forward-looking statements are based on certain key expectations and assumptions made by Surge, including expectations and assumptions the performance of existing wells and success obtained in drilling new wells; anticipated expenses, cash flow and capital expenditures; the application of regulatory and royalty regimes; prevailing commodity prices and economic conditions; development and completion activities; the performance of new wells; the successful implementation of waterflood programs; the availability of and performance of facilities and pipelines; the geological characteristics of Surge’s properties; the successful application of drilling, completion and seismic technology; the determination of decommissioning liabilities; prevailing weather conditions; exchange rates; licensing requirements; the impact of completed facilities on operating costs; the availability and costs of capital, labour and services; and the creditworthiness of industry partners.

The forward-looking statements are based on certain key expectations and assumptions made by Surge, including expectations and assumptions the performance of existing wells and success obtained in drilling new wells; anticipated expenses, cash flow and capital expenditures; the application of regulatory and royalty regimes; prevailing commodity prices and economic conditions; development and completion activities; the performance of new wells; the successful implementation of waterflood programs; the availability of and performance of facilities and pipelines; the geological characteristics of Surge’s properties; the successful application of drilling, completion and seismic technology; the determination of decommissioning liabilities; prevailing weather conditions; exchange rates; licensing requirements; the impact of completed facilities on operating costs; the availability and costs of capital, labour and services; and the creditworthiness of industry partners.

Although Surge believes that the expectations and assumptions on which the forward-looking statements are based are reasonable, undue reliance should not be placed on the forward-looking statements because Surge can give no assurance that they will prove to be correct. Since forward-looking statements address future events and conditions, by their very nature they involve inherent risks and uncertainties. Actual results could differ materially from those currently anticipated due to a number of factors and risks. These include, but are not limited to, risks associated with the condition of the global economy, including trade, public health (including the impact of COVID-19) and other geopolitical risks; risks associated with the oil and gas industry in general (e.g., operational risks in development, exploration and production; delays or changes in plans with respect to exploration or development projects or capital expenditures; the uncertainty of reserve estimates; the uncertainty of estimates and projections relating to production, costs and expenses, and health, safety and environmental risks); commodity price and exchange rate fluctuations and constraint in the availability of services, adverse weather or break-up conditions; uncertainties resulting from potential delays or changes in plans with respect to exploration or development projects or capital expenditures; and failure to obtain the continued support of the lenders under Surge’s bank line. Certain of these risks are set out in more detail in Surge’s AIF dated March 9, 2021 and in Surge’s MD&A for the year ended December 31, 2020, both of which have been filed on SEDAR and can be accessed at www.sedar.com.

The forward-looking statements contained in this press release are made as of the date hereof and Surge undertakes no obligation to update publicly or revise any forward-looking statements or information, whether as a result of new information, future events or otherwise, unless so required by applicable securities laws.

Oil and Gas Advisories

The term “boe” means barrel of oil equivalent on the basis of 1 boe to 6,000 cubic feet of natural gas. Boe may be misleading, particularly if used in isolation. A boe conversion ratio of 1 boe for 6,000 cubic feet of natural gas is based on an energy equivalency conversion method primarily applicable at the burner tip and does not represent a value equivalency at the wellhead. “Boe/d” and “boepd” mean barrel of oil equivalent per day. Bbl means barrel of oil and “bopd” means barrels of oil per day. NGLs means natural gas liquids.

This press release contains certain oil and gas metrics and defined terms which do not have standardized meanings or standard methods of calculation and therefore such measures may not be comparable to similar metrics/terms presented by other issuers and may differ by definition and application. All oil and gas metrics/terms used in this document are defined below:

Original Oil in Place (“OOIP”) means Discovered Petroleum Initially In Place (“DPIIP”). DPIIP is derived by Surge’s internal Qualified Reserve Evaluators (“QRE”) and prepared in accordance with National Instrument 51-101 and the Canadian Oil and Gas Evaluations Handbook (“COGEH”). DPIIP, as defined in COGEH, is that quantity of petroleum that is estimated, as of a given date, to be contained in known accumulations prior to production. The recoverable portion of DPIIP includes production, reserves and Resources Other Than Reserves (ROTR). OOIP/DPIIP and potential recovery rate estimates are based on current recovery technologies. There is significant uncertainty as to the ultimate recoverability and commercial viability of any of the resource associated with OOIP/DPIIP, and as such a recovery project cannot be defined for a volume of OOIP/DPIIP at this time. “Internally estimated” means an estimate that is derived by Surge’s internal QRE’s and prepared in accordance with National Instrument 51-101 – Standards of Disclosure for Oil and Gas Activities. All internal estimates contained in this new release have been prepared effective as of Jan 1, 2021.

Net of Surge disposition from March 25, 2021, the pro forma Company (Surge + Astra + Fire Sky) will have 2020YE TPP reserves of 104.5mmboe. Fire Sky reserves have been evaluated by Sproule from 2016YE through to 2020YE. Similarly, Sproule has evaluated all of Surge’s assets from 2015YE to 2020YE.

Production efficiencies are calculated by dividing capital expenditures of a project by the average production from that project for a given period of time. IP180 is the average production rate of a well over the first 180 days on production.

Drilling Inventory

This press release discloses drilling locations in two categories: (i) booked locations; and (ii) unbooked locations. Booked locations are proved locations and probable locations derived from an internal evaluation using standard practices as prescribed in the Canadian Oil and Gas Evaluations Handbook and account for drilling locations that have associated proved and/or probable reserves, as applicable.

Unbooked locations are internal estimates based on prospective acreage and assumptions as to the number of wells that can be drilled per section based on industry practice and internal review. Unbooked locations do not have attributed reserves or resources. Unbooked locations have been identified by Surge’s internal certified Engineers and Geologists (who are also Qualified Reserve Evaluators) as an estimation of our multi-year drilling activities based on evaluation of applicable geologic, seismic, engineering, production and reserves information. There is no certainty that the Company will drill all unbooked drilling locations and if drilled there is no certainty that such locations will result in additional oil and gas reserves, resources or production. The drilling locations on which the Company actually drills wells will ultimately depend upon the availability of capital, regulatory approvals, seasonal restrictions, oil and natural gas prices, costs, actual drilling results, additional reservoir information that is obtained and other factors. While certain of the unbooked drilling locations have been de-risked by drilling existing wells in relative close proximity to such unbooked drilling locations, the majority of other unbooked drilling locations are farther away from existing wells where management has less information about the characteristics of the reservoir and therefore there is more uncertainty whether wells will be drilled in such locations and if drilled there is more uncertainty that such wells will result in additional oil and gas reserves, resources or production.

Surge’s review of Fire Sky’s inventory supports > 100 gross (>100 net) internally estimated drilling locations. Fire Sky’s February 2021 Year End reserves has 118.4 net booked locations. Of these, 68.2 net are Proved locations and 50.2 net are Probable locations based on Sproule’s evaluation.

Net of Surge March 25, 2021 disposition, the pro forma Company (Surge + Fire Sky) will have over >1,050 gross (>975 net) drilling locations identified herein, of these >450 gross (>400 net) are unbooked locations. Of the 562 net booked locations identified herein, 415 net are Proved locations and 147 net are Probable locations based on Sproule’s 2020YE reserves. Assuming an average number of net wells drilled per year of 75, Surge’s >975 net locations provide 13 years of drilling.

Surge’s internally developed type curves (for both Surge and Fire Sky) were constructed using a representative, factual and balanced analog data set, as of Jan 1, 2021 for Surge type curves and July 1, 2021 for Fire Sky type curves. All locations were risked appropriately, and EUR’s were measured against OOIP estimates to ensure a reasonable recovery factor was being achieved based on the respective spacing assumption. Other assumptions, such as capital, operating expenses, wellhead offsets, land encumbrances, working interests and NGL yields were all reviewed, updated and accounted for on a well by well basis by Surge’s Qualified Reserve Evaluators. All type curves fully comply with Part 5.8 of the Companion Policy 51 – 101CP.

Non-GAAP Financial Measures

Certain secondary financial measures in this press release – including, “cash flow”, “adjusted funds flow”, “free cash flow”, and “net debt” are not prescribed by GAAP. These non-GAAP financial measures are included because management uses the information to analyze business performance, cash flow generated from the business, leverage and liquidity, resulting from the Company’s principal business activities and it may be useful to investors on the same basis. None of these measures are used to enhance the Company’s reported financial performance or position. The non-GAAP measures do not have a standardized meaning prescribed by IFRS and therefore are unlikely to be comparable to similar measures presented by other issuers. They are common in the reports of other companies but may differ by definition and application. All non-GAAP financial measures used in this document are defined below:

Cash Flow & Adjusted Funds Flow

Cash flow is defined as cash from operating activities before changes in non-cash working capital. The Company further adjusts cash flow from operating activities in calculating adjusted funds flow for changes in decommissioning expenditures and transaction and other costs. Management believes the timing of collection, payment or incurrence of these items involves a high degree of discretion and as such may not be useful for evaluating Surge’s cash flows. Changes in non-cash working capital are a result of the timing of cash flows related to accounts receivable and accounts payable, which management believes reduces comparability between periods. Management views decommissioning expenditures predominately as a discretionary allocation of capital, with flexibility to determine the size and timing of decommissioning programs to achieve greater capital efficiencies and as such, costs may vary between periods. Transaction and other costs represent expenditures associated with acquisitions, which management believes do not reflect the ongoing cash flows of the business, and as such reduces comparability. Each of these expenditures, due to their nature, are not considered principal business activities and vary between periods, which management believes reduces comparability.

Free Cash Flow

Free cash flow is calculated as cash flow from operating activities before changes in non-cash working capital less exploration and development capital expenditures. Management uses free cash flow to determine the amount of funds available to the Company for future capital allocation decisions.

Free cash flow per share is calculated using the same weighted average basic and diluted shares used in calculating income per share.

Free cash flow yield is calculated as free cash flow divided by the Company’s share price at the date indicated herein. Management uses this measure as an indication of the cash flow return to shareholders based on current share prices.

Net Debt

There is no comparable measure in accordance with IFRS for net debt. Net debt is calculated as bank debt, term debt, plus the liability component of the convertible debentures plus or minus working capital, however, excluding the fair value of financial contracts, decommissioning obligations, and lease and other obligations. This metric is used by management to analyze the level of debt in the Company including the impact of working capital, which varies with timing of settlement of these balances.

Net debt to annualized adjusted funds flow ratio is calculated as net debt divided by annualized three month adjusted funds flow (adjusted funds flow for the quarter multiplied by four). Management uses this ratio to assess the period of time that it would take to fund net debt based on the adjusted funds flow from the quarter.

All-in payout ratio

All-in payout ratio is calculated as exploration and development expenditures divided by cash flow.

Neither the TSX nor its Regulation Services Provider (as that term is defined in the policies of the TSX) accepts responsibility for the adequacy or accuracy of this release."
[],10/7/2021,"











Southern Alberta Oil Well

Oil prices shook off losses to turn positive on Thursday on indications that the United States may not release emergency crude reserves to combat rising gasoline costs, putting focus back on tight global supply.

U.S. West Texas Intermediate (WTI) oil gained $1.34, or 1.74%, to $78.26 a barrel, recovering from $74.96.

Brent futures rose $1.13, or 1.40%, to $81.94 a barrel, after falling to a session low of $79.08.

“Right now, it looks like the U.S. is signalling that they’re not planning just yet to tap their strategic petroleum reserves (SPR), and that’s kick-starting this rally here,” said Edward Moya, a senior market analyst at brokerage OANDA.

“This is still too early for the U.S. to consider tapping their reserves and we would see them make that decision when we’re deeper into winter and the energy crisis is really starting to become a bigger concern for growth.”

The U.S. Department of Energy is not considering tapping into its SPR “at this time”, nor is it pursuing a ban on oil exports, a Bloomberg News reporter said in a tweet. That was after a Financial Times report on Wednesday quoted Energy Secretary Jennifer Granholm, who said that those options were on the table.

The United States has used its strategic reserves on occasion, usually after hurricanes or other supply disruptions. However, since ending a 40-year ban on crude exports in 2015, the nation has become a significant exporter, and has not broached cutting exports.

Goldman Sachs said a potential SPR release, which could be up to 60 million barrels, only posed a $3 downside risk to its $90l year-end Brent price forecast.

Early session losses were also an extension of Wednesday’s near 2% drop after an unexpected rise in U.S. crude stockpiles and Russian assurances that it would boost gas supplies to Europe in response to the energy crunch and stands ready to stabilise the market..

Earlier this week, the Organization of the Petroleum Exporting Countries and allies (OPEC+) agreed to only gradually raise output, sending crude prices to multi-year highs.

Oil markets have been on a steady rise due to tight supplies worldwide as demand recovered more quickly than expected from the pandemic in big import markets like China.

In addition, major producers and the International Energy Agency believe crude demand could rise by anywhere from 150,000 to 500,000 barrels per day in coming months as users of natural gas switch to oil due to high gas prices."
['The Canadian Press'],10/7/2021,"











CALGARY – Canadians are being hit with all-time record gasoline prices heading into the Thanksgiving long weekend.

Federal government data shows the average national retail price for regular gasoline in Canada hit $1.45 per litre this week.

Fuel price consultancy firm Kalibrate, which has data all the way back to 2007, says these prices are record highs.

Some markets have seen double-digit week-over-week price increases. Drivers in the Manitoba cities of Brandon and Winnipeg saw the price at the pump go up by more than 11 cents per litre in the last week alone.

Overall, Canadian fuel prices are more than 40 cents per litre higher than they were last year.

Crude oil prices are at seven-year highs, which is the main factor behind higher gasoline costs. Higher carbon taxes are also reflected in retail gasoline prices."
[],10/7/2021,"











Oil prices dropped for a second session on Thursday, under pressure from an unexpected rise in U.S. crude stocks that raised concerns over demand after prices rallied to multi-year highs.

U.S. West Texas Intermediate (WTI) oil slid 0.37%, or 28 cents, to $76.62 a barrel, after the market climbed on Wednesday to $79.78, the highest since November 2014.

Brent crude lost 0.49%, or 40 cents, to $80.39 a barrel.

“Commercial stockpiles of crude rose… last week, according to EIA data,” ANZ said in a note. “Stockpiles of gasoline also surged, raising concerns of weaker demand.”

U.S. crude inventories rose by 2.3 million barrels last week, the U.S. Energy Information Administration (EIA) said, against expectations for a modest dip of 418,000 barrels. Gasoline inventories also rose, while distillate inventories were down slightly.

Global oil prices have jumped more than 50% this year, adding to inflationary pressure that could slow recovery from the COVID-19 pandemic and impact consumer demand. Natural gas and coal prices have also climbed.

The Organization of the Petroleum Exporting Countries and allies (OPEC+) said on Monday it would stick to its pact for a gradual increase in oil output, sending crude prices to multi-year highs.

“The producer group’s statement that its approach should reduce market volatility contrasts with the higher volatility that comes with tighter markets, especially when inventories are historically low,” analysts from Citi said in a note.

“Near-term, oil price movements look skewed to the upside, given growing market tightness with higher Chinese buying and incremental oil demand from the critically tight gas market for the power sector.”

OPEC+’s decision to raise oil output modestly and gradually, despite this year’s surge in prices, was partly driven by concern that demand and prices could weaken, sources close to the group told Reuters."
