Author,Publishing Date,Text
[],10/6/2021,"











Railcars holding crude oil

Canadian heavy crude’s discount to West Texas Intermediate (WTI) widened slightly on Wednesday.

Western Canada Select heavy blend crude for November delivery in Hardisty, Alberta, settled at $12.70 per barrel below the WTI benchmark, according to NE2 Canada Inc, compared with Tuesday’s settlement of $12.60 a barrel below the benchmark.

The discount on heavy crude has been inching wider since the start of this month’s trade cycle, retreating from recent five-month highs hit in anticipation of Enbridge Inc bringing its Line 3 replacement project into service.

Linefill on Line 3 started on Friday.

Light synthetic crude from the oil sands for November delivery settled at 70 cents a barrel below U.S. benchmark crude, widening from Tuesday’s settle of 15 cents per barrel under the WTI benchmark.

Global oil prices dropped nearly 2%, pulling back from multi-year highs, as an unexpected rise in U.S. crude inventories prompted buyers to take a breather after recent torrid gains."
[],10/6/2021,"DENVER – Ovintiv Inc. (NYSE: OVV) (TSX: OVV) today announced the achievement of several sustainability milestones related to emissions reductions, social responsibility and corporate governance. In addition, the Company has launched a new dynamic sustainability website, highlighting Ovintiv’s data-driven approach to environmental, social and governance (ESG) performance matters.

“Ovintiv is at the forefront of driving innovation to both profitably and sustainably produce oil and gas,” said Ovintiv President and CEO Brendan McCracken. “We are proud to provide the energy the world needs to make modern life possible. Innovating in pursuit of efficiency is what we do best, and that includes continuously improving our environmental, social and governance performance. We are committed to conducting our business in a manner that is ethically, environmentally and socially responsible; an approach which we believe delivers strong financial performance to our shareholders and responsibly-sourced and affordable energy to consumers today and into the future.”

Key highlights of Ovintiv’s recent sustainability achievements:

Delivering on 33% methane intensity reduction target in 2021, four years ahead of schedule

Expect to achieve greater than 20% reduction in scope 1&2 greenhouse gas (GHG) intensity by year end 2021 compared to 2019

Committed to establishing a Scope 1&2 GHG emission intensity target tied to 2022 compensation

As of September 1, 2021 , the company is fully aligned with the World Bank Zero Routine Flaring by 2030 initiative, nine years ahead of the World Bank’s target

, the company is fully aligned with the World Bank initiative, nine years ahead of the World Bank’s target Established real-time emissions dashboard across all operations

Achieved 7th consecutive safest year ever in 2020 with a Total Recordable Injury Frequency of 0.19

Established a social commitment leadership team and published inaugural social commitment framework

Broadened the diversity of the Company’s Board of Directors

Said Ovintiv Board Chair, Peter Dea, “We believe that trust starts with transparency, which is why we strive to be a leader in ESG disclosure, having published a sustainability report and ESG performance metrics data since 2005. We value honest dialogue with our stakeholders about key issues and we value making measurable progress on multiple fronts.”

Emissions Reductions

The Company works continuously to reduce the environmental impact of its operations and in 2020 significantly reduced flaring and venting of natural gas across its operations. Ovintiv announced today that it expects to achieve its goal of reducing methane emissions intensity by 33% in 2021 – four years earlier than originally targeted. The Company expects its 2021 methane intensity to be below 0.10 metric tons of methane per thousand barrels of oil equivalent (CH4/MBOE). The target is benchmarked against the Company’s 2019 methane intensity of 0.15 metric tons of CH4/MBOE.

In addition, Ovintiv has declared full alignment with the World Bank Routine Flaring Initiative. Ovintiv does not engage in routine flaring by ensuring that natural gas gathering infrastructure is in place for all wells drilled. In 2020, flared and vented natural gas volumes accounted for less than 0.7% of total natural gas sales volumes, down significantly from approximately 1.2% in 2019. The reductions in flaring have continued with year-to-date 2021 flaring and venting at 0.4% of total natural gas sales volumes, representing a reduction of 67% from 2019.The Company has also been working closely with third party midstream providers to reduce emissions.

In 2021, Ovintiv expects to reduce its scope 1&2 GHG emissions intensity by greater than 20% compared to 2019 levels. In 2022, the company plans to further formalize its commitment to emissions reductions by setting a GHG emissions intensity target which will be tied to compensation for all employees.

Ovintiv has adopted—and continues to adopt—a range of strategies to help reduce emissions from its operations. These best practices include innovative techniques, efficiencies and proven technology, including:

Established a real-time dashboard to monitor emissions performance data and drive further improvements

On-going, comprehensive Leak Detection and Repair (LDAR) program

Electrification of operations proximal to existing, reliable electricity infrastructure and supply

Adoption of bi-fuel (natural gas and diesel) technology in drilling and completions operations to reduce emissions and costs

Automated gas lift optimization processes to enhance production and reduce well downtime

Repair and/or replacement of high-bleed pneumatic devices with low-bleed alternatives

Social Commitment

Underpinning Ovintiv’s social commitment is an ongoing focus on protecting the health and safety of its workforce. Despite the challenges presented by COVID-19, the Company reported its seventh consecutive safest year ever in 2020, with total recordable incident frequency (TRIF) for both employees and contractors dropping to 0.19 events times 200,000 per total exposure hours.

In late 2020, Ovintiv launched a social commitment leadership team to develop a new social commitment framework for the organization. Data and feedback were gathered from internal and external subject matter experts, community representatives and trade organizations, as well as Ovintiv’s executive leadership team. The resulting framework is rooted in the Company’s foundational values of Trust, Respect, Integrity, Safety and Sustainability. It focuses on three key accountabilities: respecting stakeholders, strengthening communities, and fostering a culture of inclusion.

Ovintiv values and is committed to diversity, equity and inclusion. The Company’s corporate governance framework has been revised to further reflect Ovintiv’s commitment to a diverse and inclusive workplace. The Company has offered staff training on unconscious bias, formed an employee resource group to encourage inclusion and networking, conducted staff surveys on inclusion and facilitated sessions with guest speakers on diversity, equity and inclusion at work.

Ovintiv has an active, engaged and independent Board that is diverse by gender, ethnicity, skills and experiences. Since early 2019, the Company has deepened its board diversity, added five new directors, appointed a new independent board chairman and refreshed its committee memberships, including three new committee chairs. In February of 2021, the Board adopted a requirement that candidates of gender and racial or ethnic diversity are sought out and included in its Director search processes, commonly known as the “Rooney Rule”.

Ovintiv’s sustainability website can be found on the Company’s website at https://sustainability.ovintiv.com/"
[],10/6/2021,"











U.S. natural gas futures dropped over 10% on Wednesday after soaring to a 12-year high in the prior session as extreme volatility for energy prices around the world continues.

Analysts said U.S. futures rose on Tuesday as soaring global gas prices kept demand for U.S. liquefied natural gas (LNG) exports high. They said it dropped on Wednesday as the market shifted focus back to the situation in the United States where output is growing and utilities likely added more gas than usual to stockpiles for a fourth week in a row last week.

Since the middle of August, global gas prices have repeatedly hit fresh record highs as Europe worries it may not have enough gas in storage for the winter and insatiable demand for the fuel in Asia caused utilities around the world to compete for available LNG cargoes.

Front-month gas futures on the New York Mercantile Exchange fell 63.7 cents, or 10.1%, to settle at $5.675 per million British thermal units (mmBtu). That was the biggest daily percentage drop since September 2020.

On Tuesday, the U.S. front-month closed up over 9% at its highest since December 2008.

“Price action today has been nearly the opposite of that of yesterday,” analysts at Gelber and Associates said in a report, noting “focus in the market has momentarily shifted back to domestic metrics, and… early expectations for a bearish storage report.”

Weeks of rapid changes in U.S. gas futures boosted implied volatility, used as a determinant of an option’s premium, to an all-time high on Tuesday.

Analysts have said gas stockpiles in some European countries were more than 20% below normal for this time of year. In the United States, meanwhile, inventories were expected to reach about 3.5 trillion cubic feet (tcf) by the end of October. Analysts said that should be enough for the U.S. winter heating season even though that amount would fall short of the 3.7 tcf five-year (2016-2020) average for that time of year.

Belief that the United States will have enough gas in storage for this winter and a lack of capacity to produce more LNG for export has kept U.S. prices from rocketing to the record levels seen in Europe and Asia. However, pipeline constraints and competition for expensive LNG were expected to boost prices to multi-year highs in California and New England this winter.

Data provider Refinitiv said gas output in the U.S. Lower 48 states rose to an average of 91.8 billion cubic feet per day (bcfd) so far in October from 91.1 bcfd in September. That compares with a monthly record of 95.4 bcfd in November 2019.

With gas prices at or near record highs of $46 per mmBtu in Europe and $35 in Asia, versus just over $6 in the United States, traders said buyers around the world would keep purchasing all the LNG the United States could produce.

Data provider Refinitiv said the amount of gas flowing to U.S. LNG export plants slipped from an average of 10.4 bcfd in September to 10.0 bcfd so far in October with short-term upsets at a few Gulf Coast plants and Berkshire Hathaway Energy’s Cove Point LNG export plant in Maryland expected to remain shut for another week of planned maintenance.

But no matter how high global prices rise, the United States only has the capacity to turn about 10.5 bcfd of gas into LNG. Global markets will have to wait until later this year to get more from the United States when the sixth liquefaction train at Cheniere Energy Inc’s Sabine Pass and Venture Global LNG’s Calcasieu Pass in Louisiana are expected to start producing LNG in test mode."
[],10/6/2021,"











Oil dropped on Wednesday after hitting a multi-year high above $83 a barrel, pressured by an American Petroleum Institute (API) report showing rising crude inventories in the United States and technical indicators suggesting prices have rallied too fast.

The latest surge in the price of crude was underpinned by the refusal of the Organization of the Petroleum Exporting Countries and allies to boost output faster and comes against a backdrop of concern about tight energy supply globally.

On Monday, OPEC, Russia and other allies, known as OPEC+, chose to stay with a plan to increase output gradually and not boost it further as the United States and other consumer nations have been urging.

U.S. West Texas Intermediate dropped $1.43, or 1.81% to $77.49.

Brent crude dropped $1.38, or 1.67% to $81.16.

“An energy crisis is unfolding with winter in the northern hemisphere still to begin, and sets the stage for even higher oil prices,” said Stephen Brennock of oil broker PVM.

The price of Brent has surged more than 50% this year, adding to inflationary pressure that could slow recovery from the COVID-19 pandemic. Natural gas has surged to a record peak in Europe and coal prices from major exporters have also hit all-time highs.

Jeffrey Halley, analyst at brokerage OANDA, said both crude contracts looked overbought based on a widely followed technical indicator, the relative strength index.

“That may signal some daily pullbacks this week but does not change the underlying bullish case for oil,” he said.

Some downward pressure came from the API’s figures showing signs of slowing fuel demand.

The industry group said U.S. crude inventories rose by 951,000 barrels in the week to Oct. 1, website Oilprice.com reported, and gasoline and distillate fuel inventories also climbed.

Attention will focus later on official inventory numbers due at 1430 GMT from the Energy Information Administration."
[],10/6/2021,"











How high are oil prices really and what signal are they currently sending to producers and consumers about the need for more output and lower fuel use?

The strength of a price signal depends on both the real level of prices adjusted for inflation and the rate of change compared with recent years.

In terms of the rate of change, prices are already sending a strong signal about the need to increase production and reduce consumption, as the recovery in demand has outstripped supply after last year’s coronavirus-induced slump.

Front-month Brent futures are currently trading at more than $82 per barrel, up from less than $38 at the end of the same month last year, one of the fastest price increases in percentage terms for three decades.

Rapid price escalation is characteristic of the first year of a cyclical upswing, when consumption bounces back and grows above-trend, while producers continue to withhold output, scarred by memories of the recent slump.

The turnaround from lower/falling prices to higher/rising ones sends a signal about the need for producers to switch from reducing to increasing output, and consumers to conserve fuel rather than be profligate.

But in terms of the level of prices, adjusted for inflation, the current signal to producers and consumers is so far weaker and more ambiguous.

Comparisons with oil prices during previous cycles are distorted by the impact of inflation, which has consistently eroded the value of the U.S. dollar and tended to raise oil futures prices over time.

The impact is relatively insignificant over periods of 2-3 years, small enough to be ignored, but becomes increasingly significant over 5-year to 20-year horizons.

The dollar has lost almost a quarter of its consumer purchasing power since oil prices peaked at more than $140 per barrel in 2008.

If record Brent prices in 2008 are restated at the purchasing power of the dollar in 2021, prices peaked at more than $180 per barrel.

EVALUATING REAL PRICES

Inflation-adjusted prices in the past were much higher than they sometimes appear in retrospect, and current prices are lower than they appear in long-term historical comparisons.

In real terms, front-month Brent prices are currently in the 72nd percentile for all months since 1990, but only the 50th percentile for all months since 2000, and the 56th percentile for all months since 2010.

There is no ideal timeframe over which to evaluate real prices.

Longer comparisons incorporate more cycles but contain older, less relevant data. Shorter time frames are more relevant but contain fewer cycles and may be more distorted by short periods of high or low prices.

In the oil market, 30-year comparisons are distorted by the lengthy period of very low prices in the 1990s, which proved unsustainable, and may not be relevant to decisions a quarter of a century later.

But shorter comparisons since 2000 or 2010 are dominated by the periods of very high prices in 2007-2008 and 2011-2014, which proved equally unsustainable, and may not be relevant to decisions in the 2020s.

The four decades from 1990 to 2030 contain several actual and prospective changes in both production and consumption regimes and behaviour, which makes historical comparisons difficult.

Significant changes include massive excess production capacity in the 1990s, the shale revolution from the early 2010s and the advent of electric vehicles to compete with oil in the 2020s.

However, examining the level of prices in all these time frames, the most conservative conclusion is that the level of real oil prices is currently average or moderately high.

Real prices are sending a signal to producers and consumers about the need for more output and more fuel conservation, but not yet a very strong one.

Further significant price rises may be needed to compel consumers to reduce oil use and switch to cheaper alternatives and encourage producers to boost output."
[],10/6/2021,"CALGARY, AB – Topaz Energy Corp. (TSX: TPZ) (“Topaz” or the “Company“) is pleased to announce that it has agreed with the syndicate of underwriters co-led by Peters & Co. Limited and National Bank Financial Inc. to increase the size of the previously announced bought-deal equity financing (the “Equity Financing“). Topaz will now issue 8,800,000 common shares (the “Common Shares“) at a price of $17.10 per Common Share for gross proceeds of $150.5 million pursuant to the Equity Financing.

The underwriters will have an option to purchase up to an additional 15% of the Common Shares issued under the Equity Financing at a price of $17.10 per Common Share to cover over-allotments exercisable and for market stabilization purposes in whole or in part at any time until 30 days after the closing.

In all other respects, the terms of the Equity Financing and use of proceeds therefrom will remain as previously disclosed in the Company’s October 5, 2021 press release.

The Common Shares issued pursuant to the Equity Financing will be distributed by way of a short form prospectus in all provinces of Canada and may also be placed privately in the United States to Qualified Institutional Buyers (as defined under Rule 144A under the United States Securities Act of 1933, as amended (the “U.S. Securities Act”)) pursuant to the exemption provided by Rule 144A under the U.S. Securities Act, and may be distributed outside Canada and the United States on a basis which does not require the qualification or registration of any of the Company’s securities under domestic or foreign securities laws. The Common Shares have not been and will not be registered under the U.S. Securities Act, and this news release does not constitute an offer of securities for sale in the United States. The Common Shares may not be offered or sold in the United States absent registration or an exemption from registration.

No securities regulatory authority has either approved or disapproved of the contents of this news release. This news release shall not constitute an offer to sell or the solicitation of an offer to buy nor shall there be any sale of the securities in any State in which such offer, solicitation or sale would be unlawful."
['Xi Technologies'],10/6/2021,"











Each week, XI Technologies scans their industry data to provide trends and insights that have value for professionals doing business in the WCSB. If you’d like to receive XI’s Wednesday Word to the Wise in your inbox, subscribe here.

In March, we presented our annual top ten lists for new “drills”, charting which companies had the most successful production from new wells in 2020. In many ways, 2021 has been a bounce back year for the industry after the challenges of 2020, so looking at data for the first half of the year can be a good way to track the optimism we’ve been seeing in the sector. The following top 10 lists look at data compiled from January through to June of 2021.

You can read the previous new well production top ten report for all of 2020 here, or if you’d like to compare the first half of 2021 to the first half of 2020, you can view that report here.

To find out how you can put this kind of drilling and production data to work for you, download a case study, or contact us for a quick demo of OffsetAnalyst and/or AssetBook.

Top operators for “productive” drilling

More important than the number of wells drilled is the amount produced from those wells. Whitecap Resources and CRNL hold the top two spots on this chart thus far. Arrows indicate how they compare to their ranking in 2020. CNRL made a huge jump in this list since 2020, placing second so far in 2021 after not being in the top ten at all last year.

Top operators for new well production

Achieving a high initial production rate can have a significant impact on the overall ROI for a well or drilling program.

In the graphic below we’ve looked at IP 90 rates for new gas wells and oil wells drilled in 2020. Congratulations to Strathcona Resources and Advantage Energy for topping the current list.

Which operators achieved the best rates from their best oil wells drilled during the same time frame? So far, Suncor and Tourmaline Oil top the field.

Top 10 new producing gas wells

This list is dominated by Tourmaline Oil, with five gas wells in the ranking, four of which taking top spot. Strathcona Resources and Ovintiv also have two entries each.

Top 10 new producing oil wells

When it comes to initial production rates for oil wells drilled in 2021, Suncor tops the list by a healthy margin, while also claiming the second and seventh best results. Cenovus is the only other producer with multiple wells on the list.

Top 10 operators for new gas production

Which operators achieved the greatest gas production (in mmcf) from wells drilled in the WCSB in 2021? At this point, Tourmaline stays in the top position it held throughout 2020, with Ovintiv Energy in second and Peyto Energy in third (as each company was in 2020).

Top 10 operators for new oil production

Which operators added the highest cumulative total oil production (in mbbl) from wells drilled so far in 2021? Whitecap Resources claims the top spot after finishing second in 2020. They’re followed by Tamarack Valley Energy and Cenovus Energy.

Congratulations to all our WCSB operators and producers for the improved success thus far in 2021. If you’d like a pdf version of this data, click here to download. Want to learn more about these top-rated operators and their high performing wells? Contact XI Technologies for a demo."
[],10/6/2021,"CALGARY, AB – Dreamworks Investment Holdings Ltd. (“Dreamworks”) has acquired an aggregate of 11,834,497 common shares (“Common Shares”) of Rubellite Energy Inc. (“Rubellite”), all priced at $2.00 per Common Share, for aggregate consideration of $23,668,994.00 (the “Transaction”).

The Common Shares were acquired pursuant to the Transaction through a combination of certain Rubellite financings consisting of: (i) a $33.5 million arrangement warrant financing whereby shareholders of Perpetual Energy Inc. (“Perpetual”) were issued arrangement warrants which provided them the opportunity to purchase Rubellite shares in addition to those Rubellite shares issued under a reorganization of Perpetual, approved by its shareholders on August 31, 2021; and (ii) the concurrent closing of the maximum $20 million raised through the fully subscribed non-brokered private placement.

The 11,834,497 Common Shares acquired by Dreamworks pursuant to the Transaction constitute approximately 27.0% of the 43,809,869 outstanding Common Shares.

Dreamworks is a company controlled by Susan L. Riddell Rose (“S. Rose”). Prior to the Transaction, S. Rose owned, or controlled or directed, 534,955 Common Shares, representing approximately 25.8% of the outstanding Common Shares. Following the Transaction, S. Rose owns, or controls or directs, 13,531,336 Common Shares, representing approximately 30.9% of the outstanding Common Shares. S. Rose does not own, or control or direct any options or warrants to acquire Common Shares which are vested or vest within 60 days.

The Transaction was conducted for investment purposes.

For inquiries or a copy of the related early warning report in respect of Rubellite, a copy of which is filed on www.sedar.com, please contact SOURCE Dreamworks Investment Holdings Ltd."
