Author,Publishing Date,Text
['Terry Etam'],10/5/2021,"











I’m not sure what is politically incorrect, what isn’t these days, but screw it – some aspects of history are just too absurd to not be amused by. It becomes even funnier when, subjected to certain lenses of political correctness, the mirth is multiplied into top-notch black humour. In today’s sermon, colonialism provides just such a wonderful tipping-of-the-table.

Consider a cultural oddity of last century – ‘cargo cults’ that appeared in some undeveloped countries like Papua New Guinea. Locals were ‘blessed’ with visits from Europeans, who came ashore from huge boats. A primary influence the Europeans left behind was Pidgin English, a shorthand version of English that is endearingly direct (Prince Philip became known on some shores as “Fella belong Missus Queen”). A sadder aspect was the development of cargo cults – simple-living people with little exposure to the outer world who were mesmerized by the bountiful, strange, wonderful objects brought ashore by foreigners. They associated this stuff with the arrival of ships, and many watched and waited years for ships to return, and with them, more miraculous cargo.

Mock those people at your peril, for now the tables have turned in a poetic-justice manner. Those same colonialists that landed ashore Papua New Guinea, bringing the stench of royalty and bedazzling primitive tribes with Euro-goods, are now standing on the shores of the UK, staring out to sea, desperately hoping to see an LNG cargo ship arrive, and Papua New Guinea might very well be the home of that LNG.

Karma has a sense of humour.

Nothing against your energy crisis, UK; it truly is a tragedy in the making. The dart of accountability is aimed more at the foreheads of the climate lunatics you’ve let take the wheel. Their boneheadedness is truly breathtaking; it’s like they are standing on the deck of the Titanic staring down at the gaping hole in the side, and declaring that what the ship needs first and foremost is a salad bar. Hey, our governments have been infiltrated by those termites also, so I’m not laughing; I guess the only difference is that, since our oil/gas sector is rather critical to the economy over here, our government is having a much harder time killing it.

Here in Canada, some of us would love to help out. We would love to send you some natural gas. We have a lot. We just can’t get it to you, because we have federal leaders that care far more about what the UN thinks than about how to manage and run a country. A whole country, that is. Putin builds Europe a gas line, then plays games to maximize the haul of rubles. Canada chooses to not even get in the game.

We are working on LNG export capability, despite some bizarre internal obstacles. A few terminals may be ready a few years after you freeze to death. If you want to know why we can’t get you any natural gas, a good local place to start for the British is with the whack jobs at Extinction Rebellion, the piteous group of flailing and ignorant anarchists that originated there and spread over here like wildfire, a sort of COVID-18. You can have them back, by the way; they block roads, annoy everyone, convince no one, and wander in circles evading reality until the next siren song beckons them to assemble again in a formation of human mosquitoes.

For full disclosure, we would love to get you some natural gas not just to keep you from freezing to death, but because extracting and selling natural gas pays a lot of the bills. It would pay a hell of a lot more of them if we could get you some of our gas. Erudite industry veteran Dave Yeager posted an excellent synopsis of the issue on Twitter last week: In late September, AECO gas traded at C$2.72/GJ, US Henry Hub gas traded at US$5.03/mmbtu (approx C$6/GJ), and Asian LNG traded at US$29/mmbtu (approximately infinity compared to Canada’s pathetic number).

Canadian producers are forced to sell at this bargain basement price because we can’t get the product to global market, where it would be most welcome. Canadians are generally oblivious to the amount of money being left on the table, not to mention oblivious to your thundering need for the stuff.

Because your situation there in Europe is so dire, I don’t really have the heart to point out that the piano really is being moved over your head, and XR is cutting the rope. “China’s central government officials ordered the country’s top state-owned energy companies — from coal to electricity and oil — to secure supplies for this winter at all costs, according to people familiar with the matter,” noted Bloomberg in a (sorry) firewall-protected article. Good luck competing with them. Over here in Canada, we would liken that to a grizzly bear and a French poodle squaring off over a pork chop. Not being disrespectful of Britain’s might, mind you; just pointing out that China has 1.3 billion people to keep from revolting, and they are running for the buffet and will shoulder check anyone out of the way without blinking.

I really am loathe to inform you though that it gets worse. Much worse. In nearby India, where coal accounts for almost half of the country’s energy production, more than half of India’s 135 coal-fired power plants have only enough coal to last only three days. Government guidelines suggest a two-week supply. India also has over a billion people, and is also on a life-and-death scramble for hydrocarbons in any form. The UK’s 70 million well-looked-after citizens are going head to head with 2.5 billion that need those same fuels for survival.

And on that note, please don’t take the above bits of levity as a failure to grasp the seriousness of this global situation. A cold winter will be devastating for much of the world’s population, and I’m not talking about a government directive to set the thermostat to 65.

As one clown on Twitter put it, we are past gas-to-oil switching and approaching gas-to-furniture switching. The headlines get ever more ominous. Ten days ago, it was European zinc processors that were cutting output, now, as of early October, massive Dutch greenhouses are going dark and cutting output. I had no idea how huge Dutch greenhouses are, exporting over ten billion in food, but I’m sure you knew that, being neighbours. To make the point crystal clear to any apoplectic activists listening in, that’s the food supply shutting down, folks.

Make no mistake: this catastrophe has been purposefully engineered by energy charlatans and organizations that convinced the world it no longer needs hydrocarbons and can begin dismantling the hydrocarbon system. Every ENGO celebration of a blocked pipeline is a direct and irrefutable piece of evidence should the unthinkable happen. The games are over. It would be really great to be just writing about positive energy developments, like a burgeoning hydrogen economy, or whatnot, and if the ‘transition’ had occurred in a rational way, that would be the story. But it’s not, and wishing you all the best that those cargo ships appear on the horizon. And soon.

Buy it while it’s still legal! Before the book burnin’ starts…pick up “The End of Fossil Fuel Insanity” at Amazon.ca, Indigo.ca, or Amazon.com. Thanks for the support.

Read more insightful analysis from Terry Etam here, or email Terry here."
[],10/5/2021,"CALGARY, AB – Perpetual Energy Inc. (“Perpetual” or the “Company”) is pleased to announce the closing of the previously announced financings of Rubellite Energy Inc. (“Rubellite”), the repayment of its second lien term loan and credit facility extension, and provide an operations update.

Rubellite Financings

Rubellite has raised $83.5 million in equity, all priced at $2.00 per share, through a combination of: (i) a $33.5 million arrangement warrant financing (the “Arrangement Warrant Financing”) whereby shareholders of Perpetual were provided the opportunity to purchase Rubellite common shares (“Rubellite Shares”) in addition to those Rubellite Shares issued under the reorganization of the Company, which was approved by the shareholders on August 31, 2021; (ii) the issuance of Rubellite Shares in exchange for subscription receipts previously issued under a $30 million brokered private placement to a number of arm’s length investors, which funds have been held in escrow since closing on July 13, 2021 (the “Brokered Private Placement”); and (iii) a $20 million non-brokered private placement (the “Non-Brokered Private Placement” and collectively with the Arrangement Warrant Financing and Brokered Private Placement, the “Rubellite Financings”). The Rubellite Financings closed concurrently on October 4, 2021 and approximately 41.7 million Rubellite Shares were issued.

Approximately $53.6 million in funds from the Rubellite Financings will today repay promissory notes owed to Perpetual in connection with Rubellite’s acquisition of its Clearwater assets from Perpetual. Perpetual previously received additional non-cash consideration in the form of a five-year option to purchase 4.0 million Rubellite Shares at $3.00 per share (the “Rubellite Share Purchase Options”), providing an opportunity for Perpetual to remain exposed to potential value appreciation of the Clearwater assets sold to Rubellite.

With payments enabled through the closing of the Rubellite Financings, Perpetual’s total net debt will decline by an estimated 46% from $110 million at June 30, 2021 to approximately $59 million, inclusive of estimated capital spending at East Edson and other forecast corporate revenues and expenses during the third quarter of 2021. Interest cost savings will improve Perpetual’s liquidity by approximately $4 million annually. The general and administrative cost recoveries under the management services agreement with Rubellite are expected to further enhance Perpetual’s liquidity by approximately $2 to $3 million annually.

Second Lien Term Loan Repayment

Pursuant to the terms of the second lien debt repayment agreement with Alberta Investment Management Corporation, Perpetual has settled its $45 million second lien term loan principal plus outstanding interest with the payment of approximately $38.5 million in cash, delivery of 680,485 Rubellite Shares and later today will enter into a new second lien term loan of $2.7 million (the “New Second Lien Term Loan”). The New Second Lien Term Loan bears interest at 8.1% annually, which Perpetual may elect to pay-in-kind, and will mature on December 31, 2024. Perpetual has the ability to repay any or all of the New Second Lien Term Loan at any time without penalty. Perpetual is also committed to pay up to $4.5 million in contingent payments in the event that Perpetual’s annual average realized crude oil and natural gas prices exceed certain thresholds over the three year period ended December 31, 2023.

Credit Facility Extension

On July 15, 2021, Perpetual entered into an agreement with its syndicate of lenders to extend its revolving bank debt facility (“First Lien Credit Facility”) upon closing of the Rubellite Financings. The First Lien Credit Facility established a borrowing limit of $17 million, with an initial term to November 30, 2022 unless the revolving period is extended for a further six months subject to approval by the syndicate. If not extended on or before November 30, 2022, all outstanding advances will be repayable on May 31, 2023. The next Borrowing Limit redetermination is scheduled on or before November 30, 2021.

Including cash proceeds received from the sale of the Clearwater assets, Perpetual expects to be less than 25% drawn on the $17 million First Lien Credit Facility. Furthermore, the First Lien Credit Facility provides Perpetual with an enhanced ability to enter into risk management contracts to mitigate commodity price risk as appropriate.

Operations Update

The Rubellite transactions provide a full capital solution for Perpetual by reducing Perpetual’s net debt, normalizing the balance sheet leverage ratios and enhancing Perpetual’s ability to capture the inherent value in its asset base by funding investment opportunities to grow and sustain production and adjusted funds flow.

Operationally, the Company is participating in an active capital program at Perpetual’s 50% working interest East Edson property. The last well of the 8-well carried interest commitment that formed part of the consideration in the East Edson transaction in April 2020 was spud on July 26, 2021 and was drilled, completed and brought onstream by our joint venture partner in August. An additional six well (3.0 net) drilling program at East Edson is well advanced with the first two-well pad drilled, completed and on production in mid-September, ahead of previous expectations. Drilling operations are continuing on the final four-well pad, with production start-up expected by early November, targeting to fill the West Wolf gas plant to maximize natural gas and NGL sales through next winter.

Activity in Mannville in Eastern Alberta remains focused on waterflood optimization and battery consolidation projects and preparation for potential drilling projects in 2022."
[],10/5/2021,"Financings

Rubellite has raised $83.5 million in equity, all priced at $2.00 per share, through a combination of: (i) a $33.5 million arrangement warrant financing (the “Arrangement Warrant Financing”) whereby shareholders of Perpetual Energy Inc. (“Perpetual”) were issued arrangement warrants (the “Arrangement Warrants”) which provided them the opportunity to purchase Rubellite common shares (“Rubellite Shares”) in addition to those Rubellite Shares issued under a reorganization of Perpetual, approved by its shareholders on August 31, 2021; (ii) the issuance of Rubellite Shares on exchange of the subscription receipts previously issued under a $30 million brokered private placement to a number of arm’s length investors, which funds have been held in escrow since closing July 13, 2021 (the “Brokered Private Placement”); and (iii) the concurrent closing of the maximum $20 million raised through the fully subscribed non-brokered private placement (the “Non-Brokered Private Placement” and together with the Arrangement Warrant Financing and Brokered Private Placement, the “Financings”). The Financings resulted in the issuance of approximately 41.7 million Rubellite Shares.

Proceeds from the Financings fully repay $59.4 million in promissory notes related to the acquisition of the Company’s Clearwater assets from Perpetual.

In combination with the approximately 2.1 million Rubellite Shares issued on September 3, 2021 which formed the initial capitalization of Rubellite, the Company now has approximately 43.8 million Rubellite Shares outstanding, no debt and a working capital surplus of an estimated $22.5 million. Through its participation in the Arrangement Warrant Financing and in the Non-Brokered Private Placement, Alberta Investment Management Corporation owns approximately 8.3% of the Rubellite Shares and Sue Riddell Rose, the Company’s President and CEO, and certain entities controlled by her, owns, controls or directs, directly and indirectly, 32.0% of the Rubellite Shares. In addition, Perpetual has a five year option to purchase 4.0 million Rubellite Shares at an exercise price of $3.00 per share.

New Credit Facility

Rubellite will also today enter into a first lien credit facility with a syndicate of lenders to establish a new $3 million revolving credit facility with an initial term to May 31, 2022 and which may be extended for a further twelve months to May 31, 2023 subject to lender approval.

Operations Update

Rubellite currently has fourteen (13.0 net) producing multi-lateral wells on production, including the six (6.0 net) original wells drilled by Perpetual at Ukalta and the one (1.0 net) producing 2.5 leg multi-lateral well at Figure Lake acquired in January 2020. New wells that have been drilled, completed and commenced production include two (1.0 net) wells at Marten Hills which were rig released in early July, four (4.0 net) producing wells at Figure Lake and the first (1.0 net) of the planned eight well 2021 drilling program at Ukalta. Sales production is expected to ramp up as new wells fully recover load oil from the drilling process, which is recycled for future drilling operations, and volumes commence delivery to sales terminals.

Sales production at Marten Hills commenced in late August after fully recovering load oil from drilling operations and the eight leg multi-lateral wells on average are performing at Rubellite’s Marten Hills IP30 type curve production level of approximately 120 bbl/d of 22o API crude oil each. Two of the four new Figure Lake wells, each of which penetrated over 8,000 meters of Clearwater reservoir, were brought onstream August 26, 2021 and have recently begun producing formation oil for sales after a three-week period of load oil recovery. Two additional exploratory new wells over 10 miles north of the producing Figure Lake pad site have been drilled, completed and turned over to production operations, and have begun recovering load oil from drilling operations.

As previously planned, drilling activity has progressed to the Ukalta property where one (1.0 net) six-leg multi-lateral well has been drilled, completed and recently turned over to operations to commence load oil recovery and sales production. Rubellite’s planned single-rig drilling program for the remainder of 2021 consists of an additional seven (7.0 net) multi-lateral wells at Ukalta."
[],10/4/2021,"











Michigan's Mackinac bridge, under which Enbridge's line 5 pipeline runs.

Canada on Monday formally invoked a 1977 treaty with the United States to request bilateral negotiations over Enbridge Inc ’s Line 5, escalating a long-running dispute over one of Canada’s major oil export pipelines.

Line 5 ships 540,000 barrels per day of crude and refined products from Superior, Wisconsin, to Sarnia, Ontario, but the state of Michigan ordered Enbridge to shut it down due to worries a leak could develop in a four-mile section running beneath the Straits of Mackinac in the Great Lakes.

Enbridge ignored Michigan’s order and the sides are embroiled in a legal battle. The government of Canada has been pushing counterparts in the United States to intervene, and Monday’s move marks a step up in Ottawa’s efforts to help safeguard the pipeline.

In a letter to the federal judge presiding over the case, Gordon Giffin, legal counsel for the Canadian government, said Canada had formally invoked Article Six of the 1977 Transit Pipelines Treaty.

The treaty has never been invoked before.

Line 5 is governed by the provisions of the 1977 agreement, which guarantees the uninterrupted transit of light crude oil and natural gas liquids between the two countries, Canada’s Foreign Affairs Minister Marc Garneau said in a statement.

“Today, Canada is formally invoking the dispute settlement provision of the 1977 Agreement to ensure its full application,” Garneau said.

The U.S. State Department did not immediately respond to requests for comment.

Article Six is the process used by the treaty to resolve disputes, and Giffin’s letter asked the court to halt any proceedings related to Michigan’s Line 5 shutdown order while that is ongoing, a move criticised by environmental campaigners.

“The government of Canada took an action today that ignores the risk of an oil spill in the Great Lakes and seems clearly designed to delay a legal decision to shut down Enbridge’s twin Line 5 oil pipeline in the Straits of Mackinac,” said Sean McBrearty, co-ordinator for environmentalists Oil & Water Don’t Mix.

Earlier this year Enbridge and Michigan took part in court-ordered mediation, but Enbridge spokeswoman Tracy Larsson said Michigan has said it is not committed to further talks.

“We greatly appreciate the efforts of ‘Team Canada’ – from the Government of Canada to the provinces of Ontario, Quebec, Alberta and Saskatchewan for their commitments and efforts to keep Line 5 open,” she said in an email."
['The Canadian Press'],10/4/2021,"











Alberta oil well in canola field

Oil prices jumped Monday after OPEC and allied oil-producing countries stayed with their gradual approach to restoring output slashed during the pandemic, agreeing to add only 400,000 barrels per day in November.

The decision Monday by the Vienna-based oil cartel tracks with its established schedule of adding back that amount of oil every month until deep cuts made in 2020 to support prices during the depth of the pandemic recession are restored next year.

The situation has changed since then as the global economy recovers. The decision comes amid stronger demand for oil products like gasoline and jet fuel, as driving and flying pick up around the globe due to the easing of restrictions aimed at containing the COVID-19 pandemic.

On top of that, unusually high prices for natural gas are pushing some electricity producers in Asia to switch from natural gas to oil-based products, helping support prices.

The Brent international benchmark hit a new 3-year high at $81.67, up 2.8% on the day, the highest since 2014. West Texas Intermediate hit $78.06, up $2.34 or 3.09%

White House national security adviser Jake Sullivan raised concerns about rising oil prices when he met officials in Saudi Arabia earlier this week in talks that largely focused on the war in Yemen, according to a senior administration official who spoke on the condition of anonymity to discuss private conversations. Sullivan and other members of his delegation reiterated the importance of creating conditions to support the global economic recovery caused by the coronavirus pandemic, the official added.

Last week White House press secretary Jen Psaki said that White House officials have stayed in communication with OPEC about prices and were looking for tools to address the issue as Brent crude topped $80 per barrel last month.

U.S. national average gasoline prices have been holding steady at around $3.20 per gallon in recent days, according to motoring club federation AAA, which foresaw stable short-term gas prices with supply and demand “largely in sync.” The average is 97 cents more than a year ago."
[],10/4/2021,"











U.S. natural gas futures jumped over 7% to a fresh seven-year high on Monday on forecasts power generators will burn more of the fuel this week than previously expected and as record global gas prices keep demand for more U.S. liquefied natural gas (LNG) exports strong.

Even though the weather is expected to remain milder than normal on average across the United States through mid October, lingering pockets of warm were still expected to keep air conditioners humming in some parts of the country this week.

Gas prices around the world have soared to all-time highs for several days in a row as low stockpiles in Europe and insatiable demand in Asia cause the two regions to compete for spare LNG cargoes. Prices in Europe jumped over 80% in September, rising a seventh month in a row, as the amount of gas in storage in some European countries fell to dangerously low levels ahead of the winter heating season.

Analysts have said that gas stockpiles in some European countries were over 20% below normal for this time of year. In the United States, meanwhile, inventories were expected to reach about 3.5 trillion cubic feet (tcf) by the end of October. Analysts said that should be enough for the U.S. winter heating season even though that amount would fall short of the 3.7 tcf five-year (2016-2020) average for that time of year.

Front-month gas futures rose 40 cents, or 7.1%, to $6.019 per million British thermal units at 9:50 a.m. EDT (1350 GMT), putting the contract on track for its highest close since February 2014.

Speculators boosted their net long positions on the New York Mercantile and Intercontinental Exchanges last week for the first time in three weeks as record global prices helped the U.S. front-month climb over 9% in volatile trade, according to data from the Commodity Futures Trading Commission (CFTC).

Data provider Refinitiv said gas output in the U.S. Lower 48 states rose to an average of 91.7 billion cubic feet per day (bcfd) so far in October from 91.1 bcfd in September. That compares with a monthly record of 95.4 bcfd in November 2019.

Refinitiv projected that U.S. gas demand, including exports, would slide from an average of 85.0 bcfd this week to 83.6 bcfd next week as the weather turns milder. Those forecasts were higher than Refinitiv expected on Friday.

With gas prices at or near record highs of $33 per mmBtu in Europe and $31 in Asia, versus around $6 in the United States, traders said buyers around the world would keep purchasing all the LNG the United States could produce.

With Berkshire Hathaway Energy’s Cove Point LNG export plant expected to remain shut for another week for planned maintenance, Refinitiv said the amount of gas flowing to U.S. LNG export plants slipped modestly to an average of 10.3 bcfd so far in October from 10.4 bcfd in September.

But no matter how high global prices rise, the United States only has the capacity to turn about 10.5 bcfd of gas into LNG. Global markets will have to wait until later this year to get more from the United States when the sixth liquefaction train at Cheniere Energy Inc’s Sabine Pass and Venture Global LNG’s Calcasieu Pass in Louisiana are expected to start producing LNG in test mode."
